{
  "schema_version": 1,
  "stage": "adaptation",
  "bundle_id": "autosk-v1",
  "version": "1.1.0",
  "provenance": "autosk-native adaptation of the Agent Selection Guide and the twelve protocol files; the migration baseline is private and not published",
  "members": [
    {
      "path": "agent-selection-guide.md",
      "sha256": "efa8538d32fa1d8b9c2a51592e0cb118acd778429b13f36670a40cfec2dc1b42",
      "size": 27
    },
    {
      "path": "protocol/arena/arena-stage.md",
      "sha256": "72a136c59ebec0e43f094e4a1d9db2207d43863bda48f0f1a9ab2e16408083a4",
      "size": 32
    },
    {
      "path": "protocol/arena/judge-brief.md",
      "sha256": "721257cd9870f4d664c9b551a1cd9058eacf1d6bca65f76feb8ca12e880401b5",
      "size": 32
    },
    {
      "path": "protocol/autobuild/run-contract.md",
      "sha256": "7c93d00dcddaee36883e85e37a839365afdbc9fae69f428798d71ef78d6cb1b8",
      "size": 37
    },
    {
      "path": "protocol/playbooks/bug-fix.md",
      "sha256": "4e1d2d6e5fe2346b49156fb9935c1b8187ebdc9821a0ec34c01e4a51c409413e",
      "size": 32
    },
    {
      "path": "protocol/playbooks/feature.md",
      "sha256": "9b8ca24558c05bc0393d0ae85d4443fefa8b660526ac165454a0352719c5bd48",
      "size": 32
    },
    {
      "path": "protocol/playbooks/perf.md",
      "sha256": "61d962e9cd05c4d363683169345ee600fabf48c9dfd88a39344ac00f3e6cfc93",
      "size": 29
    },
    {
      "path": "protocol/playbooks/refactoring.md",
      "sha256": "a3e43fc46cec6148e5fa1415b18108f06586a96e62908a8afe59e96761436d29",
      "size": 36
    },
    {
      "path": "protocol/principles-digest.md",
      "sha256": "197d0fbd080b8fac37e2ef51661f3767e862ee94199d56dcf1069c9319bb8757",
      "size": 32
    },
    {
      "path": "protocol/reflect/reviewer-brief.md",
      "sha256": "a94f04594cad435b0316f45843ecd8562f1d119b1e91ddba35760cc067d8dc47",
      "size": 37
    },
    {
      "path": "protocol/verification/template.md",
      "sha256": "5d500f4879197115e84b9c55b87a46175cc8be62b98edbc40d9dbea3939b0e5c",
      "size": 36
    },
    {
      "path": "protocol/writing/technical-writing.md",
      "sha256": "bdbc4d9eba12ed0108ce83f975f6eaa7049d9ae8b0b2bdddd436c165148e9c4d",
      "size": 40
    },
    {
      "path": "protocol/writing/unslop.md",
      "sha256": "6bc783ddbdc71ec98f9fc550d92c7ce37e059dad054aa753b84fad40983f8d30",
      "size": 29
    }
  ],
  "bundle_digest": "bccd0149f991c2b24e34e6e428dc17ecf0b66546191d355d215d1de034375f59",
  "canonical_form": {
    "encoding": "utf-8",
    "line_ending": "lf",
    "path_order": "raw_bytes",
    "json_indent": 2,
    "trailing_newline": true
  },
  "attestation": {
    "candidate_digest": "bccd0149f991c2b24e34e6e428dc17ecf0b66546191d355d215d1de034375f59",
    "panel": [],
    "tool_version": "autosk-flow-governance/1.0.0",
    "schema_version": 1,
    "state": "pending_panel"
  }
}
